"Name","US foreign relations"
"","","694ae313-9a4f-4ab3-805d-9d112a188b8a","","Other/Independent","18-24","Suburban","Yes","I think everyone around the world deserves to be happy and at peace, not starving or under a dictatorship and certainly not at war with their own country","Neutral","70%","We do have a lot of problems in our own country to worry about, homelessness and addiction as well as inflation and poverty. I think our whole government needs a revamp, it’s not working.","Negative","77%","Dictatorship, a country’s citizens being attacked by their own country. ","Negative","Uncategorized","Sending millions to Ukraine ","Neutral","Uncategorized","Make sure children are never used to fight a war. ","Neutral","49%","False"
"","","9526b8b9-9b5b-4afb-87f1-71fd4ce761ce","","Other/Independent","18-24","Suburban","Yes","Because I think that human rights are a basic right and there are a lot of people who aren’t able or do not have the power to have their rights stood up for so we should help those who can’t ","Neutral","71%","Because sometimes getting involved in other countries disputes can be harmful and dangerous for the USA ","Negative","69%","I think when people are dying and something is going on that is clearly wrong and harmful to other people ","Negative","Uncategorized","I think When it can become a situation that is dangerous for Americans and can backfire ","Negative","Uncategorized","I think It is the right thing to do to stand up for the people even if you’re breaking an “ally” you need to stand up when you believe something is wrong ","Neutral","53%","False"
"","","3d7242ad-9df1-4bc9-8667-2327ce740ab5","","Other/Independent","25-34","Suburban","Yes","We have a responsibility to the global community to help ensure that all humans are being treated fairly and humanely","Neutral","69%","Different cultural perspectives, experiences, and expectations","Positive","54%","Providing humanitarian aide in times of natural disaster or other crises ","Positive","Uncategorized","Supporting Isreal in the genocide of Palestine","Neutral","Uncategorized","The US should take the same actions that they did with Ukraine (not with Israel because America is very much on the wrong side of history in this). Although allies with Rwanda, international law is being violated ","Negative","51%","False"
"","","dbba0270-3d59-418e-8cdb-06c8dc1f0fed","","Republican","35-44","Suburban","Yes","--","--","--","--","--","--","--","--","--","--","--","--","--","--","--","False"
"","","20adf707-abe3-421c-8688-0c9ff7d5990f","","Republican","25-34","Suburban","No","America needs to fix its own problems before trying to be a hero to someone else. It needs to be a hero for its own people first.","Neutral","60%","They are brainwashed into thinking everyone HAS to help everyone else out. These people believe in taking care of others before taking care of themselves.","Neutral","38%","Never has this happened to me.","Negative","Uncategorized","I did not support the US giving billions of dollars to Ukraine for war when they should figure it out themselves","Negative","Uncategorized","They should encourage the other country to figure out their problems and solve them themselves without needing a handout for help from others. This will make the US more able to show it has a backbone and free up more time to fix issues already going on.","Neutral","51%","False"
"","","8491a3f1-b3cf-4609-84fc-fb88c04c73ae","","Other/Independent","45-54","Suburban","Yes","Because it's the right thing to do and if you don't address the issue now, the people doing the harm may become more powerful and become a bigger threat.","Negative","62%","Some people only care about themselves and are to short sighted to realize that by not acting now they might have larger problems later.","Negative","52%","During WW2, we had to.","Neutral","Uncategorized","I can't think of any right now.","Neutral","Uncategorized","Not sure maybe we could remove the evil ones from power.","Neutral","47%","False"
"","","a2a05549-c87f-4aba-8a86-dba6aeee00f2","","Republican","65+","Urban","No","No, I do not believe that defending human rights globally should be a primary goal of American policy. While human rights are important, prioritizing them globally can lead to unintended consequences, such as overextension of resources and entanglement in complex international issues. It can also provoke tensions with other nations who view such actions as interference in their sovereignty. Instead, American policy should focus on domestic issues, fostering stability and prosperity at home, and ","Negative","55%","Humanitarian Values: Many Americans and global citizens prioritize humanitarian values and believe that the U.S., with its resources and influence, is uniquely positioned to make a positive impact on human rights globally

Moral Responsibility: Many believe that as a global leader, the U.S. has a moral obligation to protect and promote human rights worldwide. Ignoring human rights abuses could be seen as complicit support for those violations


Global Stability
","Neutral","52%","Humanitarian Need: The scale of the disaster necessitated immediate international assistance to save lives and provide basic needs like food, water, and medical care

Global Responsibility: As a leading global power with significant resources, the U.S. had the capacity to make a substantial positive impact in the face of this humanitarian crisis.

International Cooperation: The U.S. involvement was part of a broader, coordinated international response, demonstrating solidarity and cooperation am","Neutral","Uncategorized","Long-term Consequences: The long-term repercussions of the war included ongoing violence, political instability in Iraq, and a negative impact on the U.S.'s reputation globally.

Destabilization: The intervention led to significant instability in the region, contributing to prolonged conflict, the rise of extremist groups like ISIS, and severe humanitarian crises.

High Costs

Lack of International Support

Questionable Justification","Neutral","Uncategorized","By combining diplomatic pressure, targeted sanctions, humanitarian aid, support for peacekeeping, regional cooperation, and public advocacy, the U.S. can play a constructive role in addressing the conflict in the DRC while respecting the complexities involved","Neutral","54%","False"
"","","c1878b75-7160-4707-b3e3-386459160a0c","","Other/Independent","55-64","Suburban","Yes","My thought on this is that all World Nations should be concerned about human rights not just America. We are all humans and some of us are not capable of protecting ourselves from aggressors and need help and it should be a collective effort by All Nations and if America wants to be the leader that's not an problem for me","Neutral","72%","I think some people disagree because all they think about is America and the problems we face at home. America is their home and they feel protective of it and do not want to share our wealth or power with other nations because they are afraid that we are not taking care of our own.","Negative","77%","I think right now it's very important for us to support Ukraine in their efforts to combat fascism and communism.","Positive","Uncategorized","Although I completely support all the efforts to track down the 9/11 perpetrators I felt like we were in Afghanistan way too long and should have pulled out a long time ago.","Negative","Uncategorized","I think the US should continue to impose sanctions against Rwanda.  Although this takes time to work I think eventually it will force the government to take action that is not hostile and abusive towards other countries","Neutral","55%","False"
"","","46fbbed5-fb2d-43df-9508-d7c6b170de3d","","Republican","35-44","Rural","Yes","Because that’s basic human decency. If you see people suffering and have the resources to help, we as a country should do so. But only when we have already addressed the human rights issues within our country. ","Neutral","71%","Because as a nation currently, there are many Americans who are struggling to just feed themselves. ","Negative","65%","Humanitarian aid after natural disasters ","Neutral","Uncategorized","Anything that involves conflict over territory that is not part of our allies ","Neutral","Uncategorized","The US should immediately withdraw support ","Negative","51%","False"
"","","015e98ac-b181-4d51-a7af-3b13258e2083","","Other/Independent","18-24","Urban","No","I think the US does not do a good job at being the moral compass on a global scale and shouldn't have that role","Negative","58%","Because America is a superpower so they should use their wealth to help. Which I'm not against in theory but it's more about how they go about it ","Neutral","60%","Never lol. The US involvement ruined my country as well as many others","Neutral","Uncategorized","Iraq, Yemen, Afghanistan, Somali, and the list goes on.","Neutral","Uncategorized","I'm not sure honestly ","Neutral","51%","False"
"","","c70f4e99-a49e-4e90-ae1c-9cacbcbc7aa9","","Republican","65+","Suburban","Yes","I chose this answer because defending human rights globally is the right thing to do, especially to out allies.","Neutral","70%","--","--","--","--","--","--","--","--","--","--","--","--","False"
"","","61441f40-8623-4e17-98d2-6a0f9cccb0d5","","Republican","45-54","Rural","Yes","I think it's good to offer humanitarian aid to places experiencing conflicts.","Positive","71%","They would agree because I like the idea of helping the every day people  Others would disagree saying we should only take care of the USA.","Neutral","52%","When they are doing humanitarian aid with NATO.","Neutral","Uncategorized","Giving weapons","Neutral","Uncategorized","I do not know enough about this conflict o give a good answer.  ","Neutral","51%","False"
"","","fc40ae7a-9fa1-4b29-bfd3-4478d9381b2a","","Democrat","55-64","Suburban","Yes","As a world leader, it is the duty of the US to help others.

","Neutral","70%","They would think that America should take care of its own first and be an isolationist.","Negative","72%","I support America helping Ukraine.","Positive","Uncategorized","There hasn't been a time that I can think of.","Neutral","Uncategorized","The US should send weapons to help the side we want to win.","Neutral","50%","False"
"","","3e89fbe6-87da-4267-8232-10ce5051fa51","","Democrat","65+","Suburban","Yes","It is the moral thing to do. Always.","Neutral","68%","some might think we owe America first and the rest is none of our business,","Neutral","71%","Iraq","Neutral","Uncategorized","Viet Nam","Neutral","Uncategorized","Peaceful negotiations","Positive","52%","False"
"","","610dc980-c0b6-4581-a75d-132b478038dc","","Other/Independent","25-34","Rural","No","we should allow people decide for themselves","Neutral","53%","i do not think so","Negative","37%","no time","Neutral","Uncategorized","no time did i","Neutral","Uncategorized","--","--","--","False"
"","","42c60cf5-8c5f-4946-b4d0-75fbb96c81f1","","Other/Independent","55-64","Suburban","Yes","There are anti-NATO evil forces around our planet who must be answered for their sinister plans. No, we can't be the 'defender of all' democracies, but we must collaborate with specific allies to preserve peace and hinder the advancement of evil forces.","Negative","69%","There are selfish conspiracy theorists that believe we should ONLY invest in ourselves and ignore conflicts elsewhere. That's a great strategy for evolving current conflicts into WW III. ","Neutral","60%","I currently volunteer with ENGin, a US non-profit supporting the advancement of Ukrainians beyond the war with Putin","Neutral","Uncategorized","Did not support the Vietnam conflict (but supported our military who was ordered into conflict)","Neutral","Uncategorized","We must support standards and morality. Cannot support child soldiers in ANY way, shape or form.","Neutral","49%","False"
"","","2bc67419-a8ad-4f6a-a14e-44feec7675a0","","Other/Independent","25-34","Rural","Yes","Well there is a lot going on with America's involvement with other countries. We should be defending all life, and human rights. From every point of view, all you see is violence, hostages being taken in other countries, every life should be saved whether it's right or wrong. That is a very hard stressful thing for our soldiers to go through. The results of it all isn't good because there are consequences for every way. ","Negative","69%","Some people think from the arms part of view, to make America not seem weak and lacking of. Therefore that's one of the many conflicts we have within our country. ","Negative","71%","I honestly cannot recall or remember a time. ","Neutral","Uncategorized","Sadly with the Ukraine. They needed our help, but because of Russia is involved, it makes things all the more dangerous. They could retaliate on us as well for helping. ","Negative","Uncategorized","U.S. should help and step in, but we are already involved with so much that it can inevitably takes its toll on us. Is it worth the risk when our focus is the other countries our soldiers are in? It's dangerous. ","Neutral","52%","False"
"","","78772a9f-0aaf-4c00-ac89-29a4c2521517","","Democrat","55-64","Urban","Yes","Promoting and defending human rights globally aligns with fundamental American values, fosters international stability, and supports democratic principles worldwide. It enhances the credibility of U.S. leadership and promotes a more just and equitable world order, which benefits both national security and global humanitarian efforts.","Positive","69%","Some people might disagree due to concerns about sovereignty issues, believing that each country should manage its internal affairs independently without external interference. Others may prioritize economic or strategic interests over human rights considerations, fearing that emphasizing human rights could strain diplomatic relations or compromise national interests. Additionally, cultural relativism could lead some to argue that universal human rights standards may not apply universally across","Neutral","61%","I supported U.S. involvement in providing humanitarian aid and military support to Kurdish forces in Iraq in the fight against ISIS (Islamic State of Iraq and Syria) to counter severe human rights abuses and prevent genocide.","Neutral","Uncategorized","I did not support U.S. involvement in military intervention in Syria during the early stages of the civil war, as I believed it could escalate violence, exacerbate regional instability, and lacked clear objectives that aligned with long-term peace and stability goals in the region.","Negative","Uncategorized","The U.S. should continue diplomatic efforts to pressure Rwanda to cease support for armed groups in the Democratic Republic of Congo (DRC) and to engage in peaceful negotiations to resolve the conflict. Sanctions and diplomatic measures should be escalated if necessary to underscore the seriousness of supporting armed groups and violating human rights. Direct military intervention, however, should be approached cautiously due to the complexities and potential escalation risks in the region. Prio","Neutral","57%","False"
"","","ae8428f4-22bb-455c-80f4-40b43f167a59","","Other/Independent","35-44","Suburban","Yes","Violations of human rights are like a disease.   If they are not destroyed early on they just spread.  We need to be proactive and not reactive.  It may not affect us directly right now, but eventually like most diseases, it will reach us.","Negative","72%","I believe the main reason for most people would be that we should just focus on ourselves.  They would say we aren't world police.   It's a narrow short-sighted approach, but I imagine that is their reasoning.","Neutral","67%","The humanitarian crisis in Afghanistan after the Taliban took control of the government.  Women were set back yet again and forced out of many professions where they were both helping and exceling.  In many ways, the U.S. was partially responsible for helping facilitate the conditions for the Taliban to take control and we just let it happen.  It was an utter failure on our part.","Neutral","Uncategorized","Operation Iraqi Freedom is the biggest offender I can think of.  It's a complex issue due to the rise of power of Saddam Hussein and his dangerous growing role on the world stage, but there is no doubt we did much more damage than good.  We greatly destabilized the reason, hurt many civilians in the process, and created even greater hatred for America for Iraqis who might have otherwise been indifferent.  We don't know what that hatred to give birth to in the future.","Negative","Uncategorized","They are an ally and we should help them.  The question asks for reasons, but that is the reason.  If we have an ally, we should do everything in our power to keep them as an ally.  Realistically, helping would be very low risk for the U.S. as well.  The use of children is heinous and shouldn't be allowed period.   ","Neutral","56%","False"
"","","06f36de3-e15c-4553-9479-67d1a5d301dc","","Other/Independent","35-44","Suburban","Yes","I think by involving US in a small way then it shows our power to other countries. ","Neutral","53%","I think some people would say that it’s not America’s problem, which I agree with, but we need to show our military power to keep other countries to not try and fight us. ","Neutral","70%","I would only want to support involvement when we are really trying to offer humanitarian aid for refugees escaping an oppressive country. ","Neutral","Uncategorized","When the US tries to enforce their ideals into other countries","Neutral","Uncategorized","No action, as these two countries would need to figure out their own how to resolve their problems with one another. ","Negative","50%","False"
"","","ef65d477-5d71-429f-a9ee-a6e1a57c364a","","Democrat","25-34","Rural","Don't know","I think we have things in our country that we need to work in before we help others. But I also see how it’s important to help other countries, so I’m not sure how I feel.","Neutral","52%","They may believe that we have a duty to protect any innocents, even if they aren’t in out borders","Neutral","50%","I don’t know of any","Neutral","Uncategorized","I don’t know enough about this subject to say ","Neutral","Uncategorized","I really don’t know. I don’t feel I have enough experience to make any judgement on it. I don’t know what the right answer is.","Neutral","51%","False"
"","","2e53cf2f-9087-4190-bd5c-e3cb24dc047c","","Other/Independent","45-54","Suburban","Yes","While there are times where we can not be there for everyone. I do believe there is a point where we do need to be involved. However, We are not Superman. ","Neutral","65%","Some say if we can't help ourselves then we can't help others. ","Neutral","63%","When Russia attacked ukraine.","Neutral","Uncategorized","I can't remember ","Neutral","Uncategorized","We should provide some military action. ","Neutral","53%","False"
"","","c1031caf-5a65-4bce-829c-5e2d835f6194","","Republican","65+","Rural","No","We have enough problems here at home to take care of without joining in every conflict we can. ","Neutral","46%","Some people fell that it’s our responsibility to fund every conflict and war and send our guys over to fight. There’s a lot of money to be made off these wars. ","Negative","66%","World War two. ","Neutral","Uncategorized","Viet nam","Neutral","Uncategorized","I guess we need to send them weapons for the kids to learn to use. I’m being sarcastic. ","Neutral","51%","False"
"","","3e64b016-245b-484b-8b2f-a786b859f9f6","","Democrat","55-64","Suburban","Yes","If not us then who?  If we ignore terrorism in all it's forms then how long before it is here.","Neutral","66%","They are stupid and narrow minded.  ","Negative","29%","Ukraine war","Neutral","Uncategorized","Iraq","Neutral","Uncategorized","Same harsh sanctions they have for Russia.   Also, what carrots and sticks can be used to effect change?  I have no doubt someone in the US government knows the answer. ","Neutral","53%","False"
"","","ea65f567-586f-417f-91c3-9803b3456ac5","","Democrat","65+","Urban","Yes","Our own human rights are best protected by defending all persons","Neutral","69%","They think our sole responsibility is to our country","Neutral","68%","Defense of Ukraine from Russian invasion","Neutral","Uncategorized","Training of military in fascist governments in South America","Neutral","Uncategorized","I do not know enough about this issue to form opinion. The US should provide more information","Neutral","53%","False"
"","","fda3cb4b-83b9-4e1b-ac35-b52f9d615295","","Republican","35-44","Urban","Yes","This is because we need to protect the right of humans.","Neutral","71%","I do not think people will disagree with me since every human is entitled to basic human right.","Neutral","36%","I have not had the time to support US getting involved in another country.","Neutral","Uncategorized","There is no time .","Neutral","Uncategorized","I beieve the US needs to come to their aid to end the conflict.","Neutral","52%","False"
"","","8d4f1a2e-b246-43ed-8fc6-f118b79a8671","","Democrat","45-54","Suburban","Yes","because im not a massive p.o.s. and I believe that all people no matter where they're from deserve to be treated with respect and kindness","Positive","67%","Because they favor treating people like animals to be used as a commodity to make money off of","Negative","33%","Ukraine","Neutral","Uncategorized","Afghanistan","Neutral","Uncategorized","Id just upend the government and take over the country entirely. This would establish an American territory right in the middle of the African continent which has a plethora of advantages from strategic location to resources gained that would help immensely and in return we bring free and fair elections to go with minimum wage standards (even though ours suck) ","Neutral","53%","False"
"","","8eb38038-6d0f-4060-866d-bd73f7a37ebe","","Republican","45-54","Suburban","Don't know","I think we need to ensure our own people are safe and definitely take a stand on global human rights.  I just don't know that we need to be involved in everything.","Neutral","72%","Some people may think that human rights is important everywhere and we should always get involved.  Getting involved costs money and lives.  ","Neutral","64%","I think that helping the people in the Ukraine is a good thing.  I just don't think we should get involved in every instance.","Neutral","Uncategorized","Honestly, I can't think of a time off the top of my head.  ","Positive","Uncategorized","I haven't heard of this conflict going on.  I think it's awful that kids are having to fight.  I don't think that is fair.  I think it's possible to take a stand without actively getting involved.","Neutral","53%","False"
"","","fe75fb84-71a2-4c19-ae77-e8e3df522497","","Other/Independent","25-34","Suburban","Yes","--","--","--","--","--","--","--","--","--","--","--","--","--","--","--","False"
"","","21572ad3-76d2-4eb2-9a1d-504ddaafc949","","Other/Independent","18-24","Urban","No","There are many internal issues and human rights that need defending in America itself without having to worry about other countries","Negative","52%","They might disagree because it might help America in the long run or it will benefit America financially","Neutral","69%","N/A","Neutral","Uncategorized","The war on terror, Ukraine and Russia, Israel-Gaza conflict.","Neutral","Uncategorized","The U.S. should pull out any business operations in Congo. All the money is blood money. ","Negative","49%","False"
"","","d815c35d-e6bc-4173-b469-f78f22e6398c","","Other/Independent","25-34","Urban","Don't know","I like the idea. But in practice it has hurt America and other countries in the long run. I feel like spending on Ukraine and Israel is taking away money that could be used elsewhere here. Those wars seem at a standstill and I think if the USA can end them we should enter them. If not, if it can only be worked out or ended between the countries at conflict it’s probably best to let them be. But we should help innocent citizens get out of harms way if possible. ","Neutral","56%","Even though it can hurt the USA to enter a conflict, there is some good that comes from it. I don't think the USA should ever have been in the Middle East. When the USA left Afghanistan it caused a huge power vacuum and disrupted a lot of peoples lives living there. Women and children weren’t as safe as before. I think people would disagree with what I said previously because the idea of helping others outweighs the potential negative effects. People thought going to Vietnam was a good idea.","Neutral","65%","World War Two ","Neutral","Uncategorized","Ukraine ","Neutral","Uncategorized","If the US wants to get involved then send money. ","Neutral","54%","False"
"","","f1faf41c-98a2-42e8-96a4-c3461b727c87","","Other/Independent","25-34","Urban","Yes","Human rights are valuable, regardless of nationality.","Neutral","69%","Human rights are only valuable if you are European","Negative","37%","Can not remember a time.","Neutral","Uncategorized","Currently, USA’s unwavering support of Israel. Supporting this genocide!","Neutral","Uncategorized","Help the same way they help WHITE people.","Neutral","58%","False"
