"Name","US foreign relations"
"","","c4d074e8-b42d-4a36-8b5f-db596661c904","","Other/Independent","45-54","Suburban","Yes","I believe that America has responsibility to make sure that other countries don't take advantage of their citizens or their power. I would expect other countries to monitor America in the same way.","Neutral","48%","I believe that many people believe that America should mind its own business and allow other countries to be ruled however they want. These people believe that limited government is important and that people should take care of themselves. ","Negative","72%","During WWII when human rights were being violated at every turn and the Allied countries had to provide support.","Negative","Uncategorized","During the War on Terror and attacking countries that harbored terrorists","Negative","Uncategorized","I believe that the US should also send the same support to the DRC as they are sending to Ukraine.","Neutral","54%","False"
"","","eb584dc1-00a7-48b6-94c5-5abe722984b9","","Democrat","65+","Suburban","Yes","Our nation was founded on life, liberty, and the pursuit of happiness. We implement this via our democratic system. Part of protecting our country is joining with allies who share our way of life. This creates a level of protection that ensures we can survive and prevail against potential outside forces.","Neutral","69%","Isolationism, lack of education, a failure to understand international politics and how if can affect the US.","Negative","63%","Ukraine is an appropriate example of US involvement against USSR aggression. ","Neutral","Uncategorized","Irag was not an appropriate intervention because it was not based upon any credible evidence and it was ultimately ineffective.","Negative","Uncategorized","Stronger financial sanctions against the Rwanda government.","Negative","58%","False"
"","","960bdff5-8a56-4cda-ba29-c6339a593053","","Republican","55-64","Suburban","No","We have our own issues to deal with in our own country. We need to deal  with our issues first, before helping other countries with theirs.","Neutral","49%","Because the US is having their own struggles with inflation, cost of living, Homelessness, and Immigration issues. We need to fix our country first before helping others.","Neutral","79%","If they support the US and help our country as well, I have no problem. ","Neutral","Uncategorized","If people are looking for a free ride, and to come to the US, and get everything handed to them on a silver platter, free education, housing, etc, that's when I have a problem. Help our people first, before allowing illegal Immigrant's enter the US.","Neutral","Uncategorized","I do think more is needed. Seems the government is more concerned focusing on other countries which are our enemies.","Neutral","54%","False"
"","","4e5d950c-01aa-4d27-826f-1d5d6fa80bb9","","Democrat","18-24","Suburban","Yes","With the resources we have. We should play some sort of role to help others that are being oppressed ","Neutral","71%","We have internal issues to solve and should be putting resources to that first","Neutral","78%","The Ukraine war","Neutral","Uncategorized","Vietnam ","Neutral","Uncategorized","I would have to know more before giving my full opinion ","Negative","54%","False"
"","","93c49278-fdc6-4ecc-9022-46d0a7a0fd4a","","Democrat","35-44","Suburban","Yes","I think it is important for the US to support human rights on a global scale. We need to help ensure that basic human rights are available all over the world. The US should partner with other countries to help those that need help with this issue. ","Neutral","71%","The US has enough issues of its own that it needs to work on and resolve. We don't need to put our noses in everyone else's business or over extend ourselves. It shouldn't just be our responsibility to enforce human rights.","Neutral","79%","I support the US getting involved with Ukraine and helping support them against Russia. ","Positive","Uncategorized","I don't recall anything right now. ","Neutral","Uncategorized","The US probably shouldn't just jump right in. We can't just get involved in every conflict that pops up.","Negative","51%","False"
"","","8fc00bd8-2e98-4199-a197-b5e22aecae4a","","Other/Independent","55-64","Urban","No","It's nice to want to help other countries, at this time we have our own problems, with inflation, unemployment and housing. We should cut back some on funding other countries","Neutral","45%","We are seen as a global power and other countries need help, we have resources and we should help ","Neutral","77%","I can't think of time I supported U.S. getting involved with another country","Neutral","Uncategorized","The Ukraine war","Neutral","Uncategorized","The U.S. should intervene in the conflict, they should be able to negotiate a peaceful resolution  ","Neutral","50%","False"
"","","77bed5fe-2c51-40b1-b292-618b44e9a65c","","Republican","55-64","Suburban","No","America should take care of its own problems first","Negative","48%","People think that America would be too selfish to ignore the problems with the suffering in other countries","Negative","62%","If it would bring about a peaceful solution to an ongoing war","Neutral","Uncategorized","When it cost the US taxpayers too much money","Negative","Uncategorized","It depends on their cooperation and agreement to receive help from the US","Neutral","52%","False"
"","","1167284f-c943-4f8c-9fa0-7d3afcd80ad5","","Democrat","18-24","Suburban","Yes","I think America is uniquely equipped to support under-developed and underfunded democracies fighting against autocracy (Ukraine vs. Russia, for instance). In RIGHTEOUS cases, the US should defend human rights.","Neutral","68%","As some of the answers there suggested, there is a narrative - not entirely unfounded - that the US government has neglected parts of domestic policy when addressing/funding foreign policy. In other words, those who think the government needs to divert more resources to internal rather than external policy would disagree with my assertion that human rights everywhere are worth protecting.","Negative","71%","Supporting Ukraine over Russia.","Neutral","Uncategorized","Afghanistan War, Iraq War, Vietnam War","Neutral","Uncategorized","I think the US should tread carefully here because of Rwanda's use of children to fight, which suggests they are not as defensible as they may appear. However, I think limited support - via weapons and aid - is still feasible.","Neutral","55%","False"
"","","d2824e01-31d9-43dd-83d2-a05ba06882ee","","Republican","45-54","Suburban","Yes","Their are many whose human rights are violated and at risk and it is the responsibility of all who are able to assist in protecting them.","Neutral","70%","The resources are garnered from the US tax payers and therefore should be spent on US citizens.

Human rights are a fundamental element to all and should be protected.","Neutral","68%","The conflict between Russia and Ukraine ","Neutral","Uncategorized","Iraq war ","Neutral","Uncategorized","I’m not sure. I feel like every option has its own good and bad outcomes.","Neutral","51%","False"
"","","80d45d23-4b00-44c5-934b-7740227d4225","","Republican","55-64","Suburban","Yes","Someone has to help those who cannot help themselves and historically this has been the USA. I believe we should help ourselves as well as others. ","Neutral","59%","Some people may disagree with the US defending human rights globally because they are taking more of an isolationist approach. They do not see how things that happen to people in other countries could have an effect on themselves. ","Negative","62%","I agree that the US needed to step in by imposing sanctions on the apartheid government in 1986. The grass-roots movement that started with citizen groups made it to President Reagan who wanted South Africa to have a moral racially-sensitive regime. ","Neutral","Uncategorized","I do not think the US handled the Viet Nam ""crisis"" (war) well at all. They were ultimately unable to stop the spread of communism because they couldn't fully commit to the ""conflict."" Getting involved should call for full commitment from both the US and the people it is supposed to be helping.  ","Neutral","Uncategorized","The US could double down on the sanctions and make sure they are enforced. They could send aid to those in most dire need of assistance. ","Neutral","53%","False"
"","","18897f4e-c080-4f89-9ae6-f3b3b55473cd","","Democrat","45-54","Rural","Yes","I believe defending human rights globally should be a goal because I believe in the tenet of altruism, in that we should help others in need, because we would want the same for ourselves and have a sense of ethics in us.","Neutral","70%","People disagree because they are ethnocentric and believe that whomever exists within certain borders have more or less rights than people on the other side of arbitrary borders.  They disagree because they are thinking selfishly and not considering how it would feel if they were the person in need.","Negative","46%","World War II","Neutral","Uncategorized","Sending immigrants back to their countries of origin against their will.","Negative","Uncategorized","We should rescue the children being forced to fight.  The reason is because we have a sense of cosmic justice and karma.","Neutral","54%","False"
"","","430cb994-296c-42a2-901e-a21e031cf1cd","","Republican","55-64","Urban","Yes","The United States has a moral obligation to stand up for human rights and support those who are oppressed or facing persecution.

","Neutral","69%","They are concerned about the costs and risks of intervention.","Neutral","60%","To honor treaty obligations and support allies in times of need.","Neutral","Uncategorized","involving conflicts where the primary motivation appears to be access to natural resources.","Neutral","Uncategorized"," Provide support and resources for local and international peacebuilding efforts","Neutral","53%","False"
"","","0eb96c14-2047-4ef4-83a4-efdf64052708","","Democrat","55-64","Suburban","Yes","Though the US is imperfect, it provides the world with an image of what an effective and inclusive working democracy can look like. The US should not try to impose its will onto other countries, but protect US interests in the world and project that sense of democracy.","Neutral","58%","We have serious concerns back home in the US that are not being fully addressed. Democracy, here at home, is in danger of being eroded and it would be hypocritical for the US to get involved in other global conflicts when we're not adequately addressing the threats to democracy and conflicts in our own backyard.","Negative","77%","The hunt for Osama bin Laden.","Neutral","Uncategorized","The war in Grenada.","Neutral","Uncategorized","I don't know. Unfortunately, Black suffering doesn't register in the US.","Neutral","51%","False"
"","","43b73537-5dc8-4b9d-9e6e-c9d3b2524a32","","Other/Independent","65+","Urban","Yes","Defending human rights is always the right thing to do no matter where it is needed.","Positive","68%","I feel many people would be happy to see our country isolate itself from conflicts across the world.  ","Positive","75%","During WWII.","Neutral","Uncategorized","Vietnam and the Korean conflict.","Neutral","Uncategorized","I feel the US should help the DRC.","Neutral","52%","False"
"","","6aa69ba4-7ee8-4a73-8be7-d22e5e7a9f62","","Republican","55-64","Rural","No","America needs to focus on repairing itself right now instead of handing out money to other countries. It sounds selfish but it is necessary for the country. ","Neutral","45%","Because they think that the US should help with conflicts they feel are unfair. They think humans should be helped and rescued regardless of how they got in that situation in the first place. It isn't our business and if our government decides it is, it is for political motives. ","Negative","56%","Probably our involvement with Syria and Afghanistan","Neutral","Uncategorized","Vietnam, Iraq, Serbia, Kuwait, Israel, Pakistan/Gaza strip, Ukraine/Russia","Neutral","Uncategorized","Nothing. They need to get out of all foreign wars. The US is struggling and needs repair itself. ","Negative","47%","False"
"","","e157c209-db80-42b8-bc8a-19a455aba74f","","Other/Independent","55-64","Suburban","Yes","USA has a policy on defending human rights. This has policy for many years. I support this policy based on my beliefs.","Neutral","67%","People will have many different opinions and beliefs. People can support or oppose my opinions. Some people will agree while other will disagree. People are free to choose.","Neutral","44%","When the USA assisted other countries after a natural disaster.","Neutral","Uncategorized","When the USA stepped into another country and did not finish the mission.","Negative","Uncategorized","I am not sure what actions should be taken at this point. I do not have enough information on the described conflict.","Negative","53%","False"
"","","0e2e8c5b-990b-4d10-99fb-e926d5f85633","","Republican","55-64","Rural","No","I think our country would be stronger if we just focused on our own issues. Other countries may not see our help as helpful but as interfering and that may cause more issues for us and make our country less secure.","Neutral","50%","I think they would disagree with me on this issue because like it or not we are becoming a global nation. Other countries issue do affect us because of the global nature of things.","Negative","69%","I supported the US getting involved in helping the Ukraine.","Neutral","Uncategorized","The war in Iraq. We seemed to have not learned our lesson with Vietnam and we seemed to make the situation in Iraq worse not better for the citizens.","Neutral","Uncategorized","I think we should offer financial and weapon support if needed. It's not right that children should have to fight.","Neutral","52%","False"
"","","0ce74dbc-8bf4-4fb3-b25d-cff7437cf0c6","","Republican","18-24","Rural","Yes","As a country with resources, we should help others that do not have as many resources. Regardless of the county, every human deserves human rights. Additionally forming ties in other countries may be important to us in the future and help protect ourselves as well. ","Neutral","71%","Sometimes America cannot handle every problem when they have other major issues in their own county. People should not necessarily be sent to war for other countries because they could be hurt or killed at that country's expense. ","Negative","71%","I do not know of a specific time. However, I know there are past cases where it has been beneficial. ","Neutral","Uncategorized","I do not support the initial involvement when we dropped the Hiroshima bomb on Japan as it killed many and dragged us into the war even more than we already were.   ","Negative","Uncategorized","I think it depends on the reasoning for the conflict. However, I believe that a small group could be sent to prevent the use of children to fight. ","Neutral","51%","False"
"","","c7c82394-fab4-48f8-a4a6-1dfc322b1c1f","","Republican","55-64","Urban","Yes","I think we have the power to influence other countries and we need to use it. ","Neutral","71%","I think they would agree with me because we are on the same page","Neutral","38%","every time

","Neutral","Uncategorized","when it involves murder","Neutral","Uncategorized","be a credible mediator to solve the issue. ","Neutral","53%","False"
"","","df64fad3-28ca-41d5-b2c0-876d4625b236","","Republican","65+","Urban","Yes","Yes, advocating for human rights globally should indeed be a central goal of American policy, reflecting a commitment to universal values and promoting stability and justice worldwide.","Neutral","69%","Some may disagree that promoting human rights internationally should be the top priority in US policy because they believe that national interests should come first, because they have different opinions on sovereignty, or because they don't think these initiatives will be successful in various cultural contexts.","Negative","65%","I have supported U.S. action when it attempted to provide humanitarian relief during natural disasters or conflicts, promote democratic principles and human rights, or address global health issues requiring international assistance and collaboration.","Neutral","Uncategorized","When U.S. engagement in a foreign crisis appeared to be motivated more by geopolitical goals than by real humanitarian concerns, or when it ran the risk of unjustifiably worsening regional tensions, I have opposed it.","Neutral","Uncategorized","The United States should support regional initiatives, pursue diplomatic negotiations for peace and disarmament in the Democratic Republic of the Congo, and impose targeted penalties on those who violate human rights. This strategy avoids taking unilateral military action that can inflame tensions in favor of addressing the underlying causes of conflict and fostering a lasting peace.","Neutral","54%","False"
"","","5ef42ec1-b5bd-4016-9701-f0a7c618ceb2","","Republican","35-44","Suburban","No","We should not be the worlds police dept.","Negative","47%","They do not like the U.S and will always have a problem with what we do.","Negative","52%","When we were attacked on 9/11","Neutral","Uncategorized","Iraq","Neutral","Uncategorized","Change the leadership","Neutral","53%","False"
"","","ada8721d-8ade-44d0-b44a-39c0cfa34909","","Republican","55-64","Rural","No","We are struggling financially in the United States. We are having trouble paying our own bills. Our government is deeply in debt and while it's in debt, China is coming in and buying land from us to put solar panel farms on and for other investments.    We, the American people, can't afford the price of food, bills, etc.  Our healthcare system is one of the most expensive in the word. Our ""President"" needs to address the money that we can spend, back to our own people and national healthcare","Negative","41%","People who are well off and believe that we should remain active in abating terrorism abroad forget that someone has to pay the bill for all the tax money that is being given to Ukraine, etc.   That's coming from our pockets and some of us can't afford how expensive life has become. We are not responsible for the activities of another country.","Negative","66%","I have never supported it.","Negative","Uncategorized","All the time.  The USA needs to stay out of international disputes.","Neutral","Uncategorized","None, as they should also not take part in any international conflict.  Each government should find the means to deal with its own issues.  We did in America.    We're no better than any other country.   ","Neutral","49%","False"
"","","77f4f1d1-310d-47f5-a385-114517cb187e","","Republican","65+","Suburban","Yes","There are times when it's necessary to protect innocent lives.","Neutral","71%","It would come down to politics. The divide between left and right is wide.","Neutral","39%","It was the invasion of Ukraine by Russia.","Neutral","Uncategorized","There is none","Negative","Uncategorized","The African continent is a whole different story.  Too much to talk about here.","Neutral","55%","False"
"","","6ca1425f-a041-45f6-84cf-e7ece8c0f8e5","","Other/Independent","55-64","Suburban","Yes","We have to stick up for those you can't stick up for themselves","Negative","65%","We do have a lot of problems in this country and people might disagree with me saying we need to clean our house first","Negative","78%","The ongoing war in Ukraine","Neutral","Uncategorized","None in recent memory","Neutral","Uncategorized","Provide provide aid to those affected by conflict","Neutral","55%","False"
"","","95b20e26-fcb5-479e-8a03-70c67a700a0c","","Other/Independent","55-64","Rural","No","To them its a business model. The only way the MIC makes money is to constantly be involved in conflicts. ","Neutral","52%","Because those in power want to maintain that power. Some may not understand the layers and the deceit that goes into maintaining that power. The US has historically funded both sides of many conflicts. The ones going on now are no different.","Neutral","67%","In retrospect - never. What has been painted as ""facts"" about conflicts has always had ulterior motives. ","Negative","Uncategorized","I do not support our involvement in Ukraine. That skirmish has been going on for many years. We are not their piggy bank. It is nothing more than one huge money laundering operation. ","Negative","Uncategorized","The US will not aid the Congo because their ultimate goal is to control the resources. ","Negative","54%","False"
"","","31a18c9d-b223-41ac-ba2e-ea6d9623ca02","","Republican","55-64","Rural","Don't know","Well, it just depends on what you mean exactly by ""human rights"". There are a lot of things that people fight for that I do not agree with. It really just depends on the exact terms.","Neutral","64%","Because many people thing that the government actually pays for things, when in reality, it is US, the people, who open our wallets and pay for everything via tax upon tax upon tax. They do not realize that ""helping"" costs a lot of money but the money the government hands over to the other leaders is so far above and beyond, it's unbelievable. And it doesn't come from their pockets. We have veterans that are living on sidewalks and yet ""helping"" peoples from every country to take over hotels, et","Negative","57%","After we have our own citizens and veterans actually taken care of, etc. And when it's not a cover-up for paying money to other governments for whatever reason. Too much is hidden. ","Neutral","Uncategorized","The same as before. When it's legitimate. Actually legitimate, and not just some pay-off to other countries. Also, when other countries pay their fair share as well. We are in debt in the trillions. How is that financially responsible?","Neutral","Uncategorized","If the US and other 1st world countries were genuinely wanting to help they would help. They seem to only help countries with oil or something else that they want. It's way too deep for me. The US should be helping, not with tons of money, but with a few good men who can help them with their issues fighting the bad guys, etc. ","Neutral","57%","False"
"","","082ec259-a6db-4296-902d-226ecd8d2366","","Democrat","65+","Suburban","No","The US is not and should not be the world's police force.","Negative","47%","Some would agree that we have our own problems to work on while others will believe it's our responsibility to help.","Neutral","78%","Sending humanitarian aid in response to a natural disaster like a flood.","Neutral","Uncategorized","Going into Iraq to topple their government ","Negative","Uncategorized","It's none of our business ","Negative","47%","False"
"","","69551b4c-4be2-4da8-a79e-50b296a466a9","","Republican","65+","Suburban","Yes","I think we should support those that are in need of humane and fair human rights.  I don't necessarily think we should support them with military engagement.  I think it is the moral thing to do to try to help others, but not at the expense of our own country.","Neutral","71%","They could rightly point to the waste and corruption of the country (ies) that are receiving the aid.  Our own country could use some assistance in certain demographics.  Our debt is absolutely out of control and continuing to fund other countries problems isn't helping.","Neutral","61%","WWII","Neutral","Uncategorized","Ukraine","Neutral","Uncategorized","It sounds harsh, but we are spread thin now.  At this point, sanctions are about all I think we can or should do.  ","Neutral","53%","False"
"","","8622216e-eff8-4321-a191-270f68a1752c","","Other/Independent","65+","Urban","Yes","It was a qualified yes, depending on the definition of human rights. (Vietnam era vet answering, btw.) Freedom from tyranny and slavery are worth weighing in on. Also, we want to avoid these ideas/actions being brought to us.","Neutral","65%","Pacifists would disagree with any military action. Marxists wouldn't want nations whose principles they share to be thwarted. Some nationalists have no interest in any investments of capital or people outside the U.S. for any reason.","Negative","46%","Israel, currently.","Neutral","Uncategorized","Too simplified. Bosnia and certainly Ukraine could have been/could be handled more effectively.","Neutral","Uncategorized","I'm not familiar enough with the conflict and possible actions to answer this question usefully. That said, children shouldn't ever be used as soldiers or shields.","Neutral","50%","False"
"","","9d3541bb-860e-4e17-b5ca-742a4d004cb4","","Other/Independent","45-54","Rural","Yes","I do believe in global citizenship, and therefore, the entire planet should be concerned with human rights and try to defend them.
","Neutral","72%","I agree with the opinion that America has its own share of human rights issues that need to be addressed, and we are doing a poor job supporting many of our own citizens, however, the powers that be choose not to support our citizens. We have the resources to end poverty, hunger, and homelessness. We're just not doing it. ","Neutral","79%","Rwanda! But we didn't!","Neutral","Uncategorized","The Ukraine situation is a complex one. The US did a lot to provoke Russia, and now, we're spending billions to help remedy the mess. I'm on the fence on this one.","Neutral","Uncategorized","Well, this conflict is not receiving the same treatment because the people suffering are Black! I would need more information to give an opinion on what the US should do.","Negative","57%","False"
